Titulo_original;Titulo_encontrado;Fuente;Anio;Sinopsis;Poster_URL;Generos;Desarrolladores;Editores;Puntuacion_Usuario;Metascore;URL_Slug;Backdrop_URL;Requisitos_Minimos;Requisitos_Recomendados;Recomendaciones;Trailer_URL;Peso_GB
The Sims 3;The Sims 3;RAWG;2009.0;Los Sims 3 es la tercera entrega de la saga. Al igual que todos los juegos de Los Sims, permite al jugador controlar la vida de una persona o incluso de toda una familia. ###Creación de personajes Antes de comenzar el juego propiamente dicho, el jugador debe crear a su personaje, llamado «Sim». Se puede optar por jugar con un único personaje o con una familia. El juego ofrece una personalización completa para cada Sim: el jugador elige su género, edad, raza y tipo de cuerpo, así como los rasgos que determinarán su comportamiento dentro del juego. Estos rasgos ayudan a los Sims a adquirir nuevas habilidades que les serán útiles tanto en su trabajo como en su vida social. También existe la opción de asignar todos los parámetros al azar. Asimismo, hay ajustes que determinan si los Sims envejecerán y a qué velocidad lo harán.;https://media.rawg.io/media/games/369/36914d895c20e35f273286145c267764.jpg;Simulation, Casual;Electronic Arts, Edge of Reality, The Sims Studio;Electronic Arts;4.03;86;the-sims-3;https://media.rawg.io/media/games/369/36914d895c20e35f273286145c267764.jpg;"OS: Windows XP (Service Pack 2) or Windows Vista (Service Pack 1) Processor: (XP) 2.0 GHz P4 processor or equivalent; (Vista) 2.4 GHz P4 processor or equivalent Memory: (XP) 1 GB; (Vista) 1.5 GB Graphics: 128 MB Video Card with support for Pixel Shader 2.0 DirectX®: Hard Drive: At least 6.5 GB of hard drive space with at least 1 GB additional space for custom content Sound: Built-in Graphics:Intel Integrated Chipset, GMA X3000 or above. 2.6 GHz Pentium D CPU, or 1.8 GHz Core 2 Duo, or equivalent";;;;26
The Sims 4 v1.119.109;The Sims 4;RAWG;2014.0;Disfruta del poder de crear y controlar personas en un mundo virtual. Los Sims 4 cuenta con una profunda creación de personajes, construcción de hogares flexible y un creciente mundo de expansiones que abarcan cada aspecto de la vida simulada.;https://media.rawg.io/media/games/e44/e445335e611b4ccf03af71fffcbd30a4.jpg;Strategy, Simulation, Casual;Electronic Arts, Maxis;Electronic Arts;3.67;67.0;the-sims-4;https://media.rawg.io/media/games/e44/e445335e611b4ccf03af71fffcbd30a4.jpg;Minimum: Requires a 64-bit processor and operating system OS: 64 Bit Required. Windows 7 (SP1), Windows 8, Windows 8.1, or Windows 10 Processor: 1.8 GHz Intel Core 2 Duo, AMD Athlon 64 Dual-Core 4000+ or equivalent (For computers using built-in graphics chipsets, the game requires 2.0 GHz Intel Core 2 Duo, 2.0 GHz AMD Turion 64 X2 TL-62 or equivalent) Memory: 4 GB RAM Graphics: 128 MB of Video RAM and support for Pixel Shader 3.0. Supported Video Cards: NVIDIA GeForce 6600 or better, ATI Radeon ;Recommended: Requires a 64-bit processor and operating system OS: 64 Bit Windows 7 (SP1), 8, 8.1, or 10 Processor: Intel core i5 or faster, AMD Athlon X4 Memory: 8 GB RAM Graphics: NVIDIA GTX 650 or better DirectX: Version 9.0 Network: Broadband Internet connection Storage: 18 GB available space;;;47
The Sims Medieval Ultimate;The Sims Medieval;RAWG;2011.0;Combina la simulación de vida de Los Sims con un entorno de reino medieval. Construye y gestiona un reino, controla a Sims heroicos con diferentes profesiones y completa misiones para dar forma al destino de tu reino.;https://media.rawg.io/media/games/9a3/9a393c1d075d4a475fa8e6e41fe8c096.jpg;Strategy, Simulation;The Sims Studio;Electronic Arts;3.79;78.0;the-sims-medieval;https://media.rawg.io/media/games/9a3/9a393c1d075d4a475fa8e6e41fe8c096.jpg;;;;;4
The Surge;The Surge;RAWG;2017.0;Un catastrófico evento te deja inconsciente tu primer día de trabajo en un enorme complejo industrial. Vestido con un mortífero exoesqueleto CREO, lucha a través de empleados infectados y drones robóticos en este brutal action-RPG.;https://media.rawg.io/media/games/396/3963e0df75c22d5995368ec43dacc19e.jpg;Action, RPG;Focus Home Interactive, Deck13;Focus Home Interactive;3.19;72.0;the-surge;https://media.rawg.io/media/games/396/3963e0df75c22d5995368ec43dacc19e.jpg;Minimum: OS: Windows 7/8/10 (64-bit) Processor: AMD FX-8320 (3,5 GHz) / Intel i5-4690K (3,5 GHz) Memory: 8 GB RAM Graphics: 1 GB, AMD Radeon R7 360 / NVIDIA GeForce GTX 560 Ti DirectX: Version 11 Network: Broadband Internet connection Storage: 15 GB available space Additional Notes: INTERNET CONNECTION REQUIRED FOR GAME ACTIVATION;Recommended: OS: Windows 7/8/10 (64-bit) Processor: AMD FX-8370 (4,0 GHz) / Intel Core i7-3820 (3,6 GHz) Memory: 16 GB RAM Graphics: 4 GB, AMD Radeon RX 480 / NVIDIA GeForce GTX 970 DirectX: Version 11 Network: Broadband Internet connection Storage: 15 GB available space Additional Notes: INTERNET CONNECTION REQUIRED FOR GAME ACTIVATION;;https://steamcdn-a.akamaihd.net/steam/apps/256683553/movie_max.mp4;3
The Swapper;The Swapper;RAWG;2013.0;The Swapper es un plataformas de puzles clásico con elementos Metroidvania. Usa un dispositivo que crea clones de ti mismo e intercambia tu conciencia entre ellos para resolver rompecabezas espaciales cada vez más complejos en una inquietante estación espacial.;https://media.rawg.io/media/games/6fc/6fcb1c529c764700d55f3bbc1b0fbb5b.jpg;Action, Adventure, Indie, Puzzle, Platformer;Curve Digital, Facepalm Games;Curve Digital, Facepalm Games;3.53;87.0;the-swapper;https://media.rawg.io/media/games/6fc/6fcb1c529c764700d55f3bbc1b0fbb5b.jpg;OS:Windows XP SP3 or later, 64/32bit Processor:Dual Core CPU (2.2+ GHz Dual Core CPU or better) Memory:1 GB RAM Graphics:GeForce® 8800 or Radeon® HD4800 series, 512 MB of memory, OpenGL 3.0 support required Hard Drive:1 GB HD space Additional:Intel HD Graphics are not officially supported. But if you've got yourself a 3000 or better then there is a reasonable chance it will mostly/sorta work. No promises, but we've been working hard on it, at any rate.;;;;1
The Witcher 3 Wild Hunt v4.04;The Witcher 3: Wild Hunt;RAWG;2015.0;La tercera entrega de la serie no guarda nada para el jugador. Una aventura en mundo abierto donde el brujo Geralt de Rivia busca a su hija adoptiva Ciri, perseguida por la Cacería Salvaje, a través de un continente devastado por la guerra.;https://media.rawg.io/media/games/618/618c2031a07bbff6b4f611f10b6bcdbc.jpg;Action, RPG;CD PROJEKT RED;CD PROJEKT RED;4.64;92.0;the-witcher-3-wild-hunt;https://media.rawg.io/media/games/618/618c2031a07bbff6b4f611f10b6bcdbc.jpg;;;;;44
The Witcher 2: Assassins of Kings;The Witcher 2: Assassins of Kings;RAWG;2011.0;La versión de Games on Demand es compatible con el inglés. Descarga el manual de este juego buscándolo en http://marketplace.xbox.com y seleccionando «Ver manual del juego». The Witcher 2: Assassins of Kings presenta una historia profunda y madura que establece un nuevo estándar para la narrativa de juegos realista y no lineal. Además de una historia épica, el juego cuenta con un complejo sistema de combate que combina de forma única elementos tácticos profundos con acción dinámica.;https://media.rawg.io/media/games/bba/bba9dff323894856be2b2638f2b8aed0.jpg;RPG;CD PROJEKT RED;CD PROJEKT RED, Atari;4.32;88;the-witcher-2-assassins-of-kings;https://media.rawg.io/media/games/bba/bba9dff323894856be2b2638f2b8aed0.jpg;;;;;20
The Witcher Enhanced Edition Directors Cut;The Witcher: Enhanced Edition Director's Cut;RAWG;2008.0;The Witcher es la primera entrega de la saga que sigue a Geralt de Rivia, un mutante cazador de monstruos. La Edición Mejorada añade la historia de la Hermandad de las Antorchas, traducciones mejoradas y dos horas de nuevo contenido.;https://media.rawg.io/media/games/ee3/ee3e10193aafc3230ba1cae426967d10.jpg;Action, RPG;CD PROJEKT RED;1C-SoftClub, CD PROJEKT RED, Atari;4.06;86.0;the-witcher-enhanced-edition-directors-cut;https://media.rawg.io/media/games/ee3/ee3e10193aafc3230ba1cae426967d10.jpg;Minimum: Supported OS: Microsoft® Windows® /XP/Vista DirectX Version: DirectX 9.0c (included) or higher Processor: Intel Pentium 4 2.4 GHz or Athlon 64 +2800 (Intel Pentium 4 3.0 GHz or AMD Athlon 64 +3000 recommended). Athlon XP series, such as the Athlon XP +2400, is not supported Graphics: NVIDIA GeForce 6600 or ATI Radeon 9800 or better (NVIDIA GeForce 7800 GTX or ATI Radeon X1950 XT or better recommended) Memory: 1 GB RAM (2 GB RAM recommended) Sound: DirectX version 9.0c-compatible sound c;;;;7
Tiny Glade v1.14.2;Tiny Glade;RAWG;2024.0;Tiny Glade es un pequeño constructor de dioramas donde dibujas castillos caprichosos, acogedoras cabañas y nevados pueblecitos. Una herramienta puramente creativa y relajante sin objetivos ni enemigos: solo construcción tranquila.;https://media.rawg.io/media/games/2b8/2b83bcf74366f52296427c559803f6a6.jpeg;Strategy, Simulation, Casual, Indie;Pounce Light;Pounce Light;3.63;;tiny-glade;https://media.rawg.io/media/games/2b8/2b83bcf74366f52296427c559803f6a6.jpeg;Minimum: Requires a 64-bit processor and operating system OS: Windows 10+ Processor: Intel Core i5 or AMD Ryzen Memory: 4 GB RAM Graphics: For 720p: Radeon R9 270, GeForce GTX 670 (Kepler architecture, driver 472.12+), Intel Iris Xe, or similar (with 2+ GB of VRAM) Storage: 3 GB available space Sound Card: Yes, please;Recommended: Requires a 64-bit processor and operating system OS: Windows 10+ Processor: Intel Core i5 or AMD Ryzen Memory: 4 GB RAM Graphics: For 1080p: Radeon RX 580, GeForce GTX 1060, Intel Arc A380, or similar (with 4+ GB of VRAM) Storage: 3 GB available space Sound Card: Absolutely;;;1
Titanfall 2 v2.0.11.0;Titanfall 2;RAWG;2016.0;Titanfall 2 ahora tiene una campaña de un jugador completa. El fusilero Jack Cooper forma un vínculo con su Titán BT-7274 mientras luchan tras las líneas enemigas, combinando la agilidad del parkour en muros con el combate de mecas gigantes.;https://media.rawg.io/media/games/569/56978b5a77f13aa2ec5d09ec81d01cad.jpg;Action, Shooter;Respawn Entertainment;Electronic Arts;4.31;87.0;titanfall-2;https://media.rawg.io/media/games/569/56978b5a77f13aa2ec5d09ec81d01cad.jpg;Minimum: Requires a 64-bit processor and operating system OS: Win 7/8/8.1/10 64bit Processor: Intel Core i3-6300t or equivalent [4 or more hardware threads] Memory: 8 GB RAM Graphics: NVIDIA Geforce GTX 660 2GB or AMD Radeon HD 7850 2GB DirectX: Version 11 Storage: 45 GB available space;Recommended: Requires a 64-bit processor and operating system OS: Win 7/8/8.1/10 64bit Processor: Intel Core i5-6600 or equivalent Memory: 16 GB RAM Graphics: NVIDIA Geforce GTX 1060 6GB or AMD Radeon RX 480 8GB DirectX: Version 11 Storage: 45 GB available space;;;24
Tom Clancy's Ghost Recon Advanced Warfighter;Tom Clancy's Ghost Recon: Advanced Warfighter;RAWG;2006.0;Comanda tu escuadrón Ghost en una guerra urbana del futuro cercano. Como el sargento Scott Mitchell, usa tecnología avanzada y comandos tácticos de escuadrón para neutralizar un golpe de Estado militar en Ciudad de México en este shooter táctico en tercera persona.;https://media.rawg.io/media/games/d5d/d5d1285eda70648606e4ce108d8e82b9.jpg;Action, Shooter;Ubisoft, Ubisoft Paris, Red Storm, GRIN;Ubisoft Entertainment;3.5;85.0;tcs-graw;https://media.rawg.io/media/games/d5d/d5d1285eda70648606e4ce108d8e82b9.jpg;;;;;3
Tomb Raider 2013 Game of the Year Edition v1.01;Tomb Raider;RAWG;2013.0;Un renacimiento cinematográfico de la saga en forma de acción en tercera persona. Lara Croft sobrevive a un naufragio en una misteriosa isla y debe transformarse de una chica asustada a una dura superviviente para escapar, en el oscuro origen de la icónica heroína.;https://media.rawg.io/media/games/021/021c4e21a1824d2526f925eff6324653.jpg;Action;Crystal Dynamics;Square Enix;4.06;86.0;tomb-raider;https://media.rawg.io/media/games/021/021c4e21a1824d2526f925eff6324653.jpg;Minimum: OS:Windows XP / Windows Vista / Windows 7 Processor:1.8 GHz Processor Memory:512 MB RAM Graphics:3D graphics card compatible with DirectX 9 DirectX®:9.0 Hard Drive:2 GB HD space;;;;12
Torchlight 2 v1.25.9.5;Torchlight II;RAWG;2012.0;Torchlight II es la segunda entrega de la saga. Amplía la fórmula action-RPG del original con entornos más abiertos, multijugador cooperativo para hasta 6 jugadores y una nueva serie de clases de personaje y enemigos.;https://media.rawg.io/media/games/c06/c06d88c35785c8003147cb53c84af033.jpg;Action, RPG;Runic Games, Perfect World Entertainment;Perfect World Entertainment, Runic Games, Perfect World;3.84;88.0;torchlight-ii;https://media.rawg.io/media/games/c06/c06d88c35785c8003147cb53c84af033.jpg;OS: Windows XP SP3/Vista/Windows 7 Processor: x86-compatible 1.4GHz or faster processor Memory: 1GB System RAM Hard Disk Space: 1.7GB free space (subject to change) Video Card: DirectX compatible 3D graphics card with at least 256MB of addressable memory. DirectX®: 9.0c Internet: A broadband internet connection (for Steam download and online multiplayer) - Online multiplayer requires a free Runic Account;;;;2
Tunic v02.03.2023;Tunic;RAWG;2022.0;Explora una tierra llena de leyendas perdidas, poderes ancestrales y feroces monstruos. Controla a un pequeño zorro en una gran aventura, desvelando secretos crípticos y reconstruyendo un manual de instrucciones para comprender el mundo.;https://media.rawg.io/media/games/2c1/2c1984e128ac48b89953ed4de4904a3b.jpg;Action, Adventure, Indie;ISOMETRICORP Games, Andrew Shouldice;Finji;4.11;86.0;tunic;https://media.rawg.io/media/games/2c1/2c1984e128ac48b89953ed4de4904a3b.jpg;Minimum: OS: Windows 7 Processor: Intel i5 Quad-Core Memory: 4 GB RAM Storage: 1 GB available space;;;https://steamcdn-a.akamaihd.net/steam/apps/256686619/movie_max.mp4;1
Uncharted 4 Legacy of Thieves Collection;Uncharted: Legacy of Thieves Collection;RAWG;2022.0;Busca tu fortuna y deja tu huella en el mundo. La Legacy of Thieves Collection incluye Uncharted 4: El Desenlace del Ladrón y Uncharted: El Legado Perdido, ambos remasterizados para PC.;https://media.rawg.io/media/games/de6/de66bc4c72b45c3bb906c85d0628112d.jpg;Action, Adventure;Naughty Dog, Iron Galaxy Studios;Sony Interactive Entertainment, PlayStation PC;4.47;;uncharted-legacy-of-thieves-collection;https://media.rawg.io/media/games/de6/de66bc4c72b45c3bb906c85d0628112d.jpg;Minimum: OS: Windows 10 64-bit Processor: Intel i5-4330, AMD Ryzen 3 1200 Memory: 8 GB RAM Graphics: NVIDIA GTX 960 (4 GB), AMD R9 290X (4 GB) DirectX: Version 12 Storage: 126 GB available space;Recommended: OS: Windows 10 64-bit Processor: Intel i7-4770, AMD Ryzen 5 1500X Memory: 16 GB RAM Graphics: NVIDIA GTX 1060 (6 GB), AMD RX 570 (4 GB) DirectX: Version 12 Storage: 126 GB available space;;;99
Until Dawn;Until Dawn (Remake);RAWG;2024.0;Reconstruido y mejorado para PC. Until Dawn te invita a revivir la pesadilla de ocho amigos atrapados en una montaña remota con un asesino. Cada decisión importa, hasta el amanecer.;https://media.rawg.io/media/games/d4a/d4adb09d67998e339551acb0e15c1e99.jpg;Action, Adventure;Ballistic Moon;PlayStation PC, PlayStation Publishing;4.03;;until-dawn-2;https://media.rawg.io/media/games/d4a/d4adb09d67998e339551acb0e15c1e99.jpg;Minimum: Requires a 64-bit processor and operating system OS: Windows 10, 11 Processor: Intel Core i7 4790K / AMD Ryzen 5 1500x (or similar processor with AVX support) Memory: 8 GB RAM Graphics: NVIDIA GeForce GTX 1660 / Radeon RX 470 (or equivalent card with minimum 6GB VRAM) Storage: 70 GB available space Additional Notes: Storage 70 GB on SSD;Recommended: Requires a 64-bit processor and operating system OS: Windows 10, 11 Processor: Intel Core i5 8600 / AMD Ryzen 7 2700X Memory: 16 GB RAM Graphics: NVIDIA GeForce RTX 2060 / AMD Radeon RX 6600XT Storage: 70 GB available space Additional Notes: Storage 70 GB on SSD;;;57
Warcraft II v2.02;Warcraft II: Remastered;RAWG;2024.0;Domina las mareas en el segundo título icónico de Warcraft. Comanda tu propia flota en una versión completamente remasterizada del clásico RTS, con gráficos actualizados y todo el contenido original de la base y las expansiones.;https://media.rawg.io/media/screenshots/4f4/4f4b03621788793e7841452c3500478e.jpg;Strategy;;Blizzard Entertainment;0.0;;warcraft-ii-remastered;https://media.rawg.io/media/screenshots/4f4/4f4b03621788793e7841452c3500478e.jpg;;;;;1
Warcraft III Reforged;Warcraft III: Reforged;RAWG;2020.0;Warcraft III: Reforged es una impresionante reimaginación del revolucionario juego de estrategia en tiempo real. Revive los eventos fundamentales del RTS que definió una generación con visuales remasterizados y jugabilidad actualizada.;https://media.rawg.io/media/games/4e9/4e908c9270228430128105bcd88e51bc.jpg;RPG, Strategy;;Activision Blizzard;2.35;59.0;warcraft-iii-reforged;https://media.rawg.io/media/games/4e9/4e908c9270228430128105bcd88e51bc.jpg;;;;;32
WarCraft III v1.27b;Warcraft III: Reforged;RAWG;2020.0;Una reimaginación de la legendaria Warcraft III. Sigue el destino de Azeroth en las campañas de Humanos, No-muertos, Orcos y Elfos de la Noche en visuales HD remasterizados.;https://media.rawg.io/media/games/4e9/4e908c9270228430128105bcd88e51bc.jpg;RPG, Strategy;;Activision Blizzard;2.35;59.0;warcraft-iii-reforged;https://media.rawg.io/media/games/4e9/4e908c9270228430128105bcd88e51bc.jpg;;;;;3
Watch Dogs - Legion v1.5.6;Watch Dogs: Legion;RAWG;2020.0;En Watch Dogs Legion, construyes una resistencia con prácticamente cualquier persona en un Londres del futuro cercano bajo control autoritario. Recluta PNJ con rasgos, habilidades e historias únicas para formar tu colectivo de hackers.;https://media.rawg.io/media/games/415/41563ce6cb061a210160687a4e5d39f6.jpg;Action, Shooter, Adventure;Ubisoft, Ubisoft Toronto;Ubisoft Entertainment;3.12;72.0;watch-dogs-legion;https://media.rawg.io/media/games/415/41563ce6cb061a210160687a4e5d39f6.jpg;Minimum: Requires a 64-bit processor and operating system OS: Windows 10 (64-bit versions) Processor: Intel Core i5-4460 or AMD Ryzen 5 1400 290X Memory: 8 GB RAM Graphics: NVIDIA GeForce GTX 970, NVIDIA GeForce GTX 1650, or AMD Radeon R9 290X DirectX: Version 11 Network: Broadband Internet connection Storage: 115 GB available space;Recommended: Requires a 64-bit processor and operating system OS: Windows 10 (64-bit versions) Processor: Intel Core i7-4790 or AMD Ryzen 5 1600 Memory: 8 GB RAM Graphics: NVIDIA GeForce GTX 1060, NVIDIA GeForce GTX 1660 S, or AMD Radeon RX 480 DirectX: Version 11 Network: Broadband Internet connection Storage: 115 GB available space;;;62
What Remains of Edith Finch;What Remains of Edith Finch;RAWG;2017.0;La familia Finch, conocida como 'la familia más desafortunada de América', vive bajo la creencia de que están malditos. Como Edith, explora la casa familiar y experimenta los últimos momentos de cada miembro fallecido de la familia.;https://media.rawg.io/media/games/34e/34e100b1f648de99f32d477065f04653.jpg;Adventure, Indie;Annapurna Interactive, Giant Sparrow;Annapurna Interactive;4.38;89.0;what-remains-of-edith-finch;https://media.rawg.io/media/games/34e/34e100b1f648de99f32d477065f04653.jpg;7 / 8 / 10Processor: Intel i3 2125 3.30 GHz or laterMemory: 2 GB RAMGraphics: GeForce GTX 750/AMD Radeon 7790 or laterStorage: 5 GB available spaceMouse, Keyboard;;;https://steamcdn-a.akamaihd.net/steam/apps/256675828/movie_max.mp4;2
Wheelman;Wheelman;RAWG;2009.0;Combinando espectaculares acrobacias al estilo Hollywood con una apasionante trama, Wheelman convierte a Vin Diesel en el agente encubierto Milo Burik en una historia de alta octanaje ambientada en las calles de Barcelona.;https://media.rawg.io/media/games/c47/c47f05d0a4a5ad5f6121368ec2d2f398.jpg;Action, Shooter;Tigon Studios, Midway Studios - Newcastle;Midway Games, Midway Home Entertainment;2.91;63.0;wheelman;https://media.rawg.io/media/games/c47/c47f05d0a4a5ad5f6121368ec2d2f398.jpg;;;;;4
World of Final Fantasy v05.11.2018;WORLD OF FINAL FANTASY;RAWG;2016.0;Viaja a la mágica tierra de Grymoire como los hermanos gemelos Reynn y Lann, que pueden capturar y apilar pequeñas criaturas llamadas Mirages para que luchen junto a ellos. Incluye personajes clásicos de Final Fantasy en un estilo chibi.;https://media.rawg.io/media/screenshots/daf/daf2a24d9727b1511673fbfece306b94.jpg;RPG;Square Enix;Square Enix;3.5;77.0;world-of-final-fantasy;https://media.rawg.io/media/screenshots/daf/daf2a24d9727b1511673fbfece306b94.jpg;Minimum: OS: Windows 7 64bit Processor: Intel Core i3 2.0GHz or above Memory: 4 GB RAM Graphics: NVIDIA GeForce GTS 450 1GB or higher, Radeon HD 5770 1GB or higher DirectX: Version 11 Storage: 15 GB available space Sound Card: Sound device that supports DirectX 11;Recommended: OS: Windows 8/8.1 64bit and Windows 10 64 bit Processor: Intel Core i3 2.4GHz or above Memory: 8 GB RAM Graphics: NVIDIA GeForce GTX 660 2GB or higher, Radeon HD 7850 2GB or higher DirectX: Version 11 Storage: 15 GB available space Sound Card: Sound device that supports DirectX 11;;https://steamcdn-a.akamaihd.net/steam/apps/256698717/movie_max.mp4;9
Wuchang Fallen Feathers Deluxe Edition v178111;Wuchang: Fallen Feathers;RAWG;2025.0;Ambientada en los caóticos últimos años de la Dinastía Ming, Wuchang: Fallen Feathers es un exigente action-RPG donde una guerrera combate una misteriosa plaga que transforma a las personas en monstruos en una oscura China de fantasía.;https://media.rawg.io/media/games/bce/bcee4b00b58e05d52b8bb032ff7117f4.jpg;Action, Adventure, RPG;Leenzee Games, Leenzee;505 Games;3.58;;wuchang-fallen-feathers;https://media.rawg.io/media/games/bce/bcee4b00b58e05d52b8bb032ff7117f4.jpg;Minimum: OS: Windows10 64bit Processor: Intel Core i5-8400/AMD Ryzen 5 1600 Memory: 16 GB RAM Graphics: NVIDIA GeForce GTX 1060 6GB/AMD Radeon RX 580 8GB DirectX: Version 12 Storage: 60 GB available space Additional Notes: HDD Supported, SSD Recommended. The above specifications were tested with DLSS/FSR enabled.;Recommended: OS: Windows10/11 64bit Processor: Intel Core i7-9700/AMD Ryzen 5 5500 Memory: 16 GB RAM Graphics: NVIDIA GeForce RTX 2070/AMD Radeon RX 5700 XT/INTEL Arc A750 DirectX: Version 12 Storage: 60 GB available space Additional Notes: SSD Required. The above specifications were tested with DLSS/FSR enabled.;;;15
X-Men Origins Wolverine;X-Men Origins: Wolverine;RAWG;2009.0;Descubre el trágico pasado de Wolverine y cómo se creó el arma definitiva. Controla a Wolverine en este brutal juego de acción, usando la regeneración y las retráctiles garras de Adamantium para destrozar a los enemigos.;https://media.rawg.io/media/games/ce3/ce38c9a778138b8886355c40d727f0d8.jpg;Action;Raven Software, Amaze Entertainment, Griptonite Games;Activision Blizzard;4.03;75.0;x-men-origins-wolverine;https://media.rawg.io/media/games/ce3/ce38c9a778138b8886355c40d727f0d8.jpg;;;;;7
Yu-Gi-Oh! EARLY DAYS COLLECTION;Yu-Gi-Oh! EARLY DAYS COLLECTION;RAWG;;Duela junto a viejos amigos mientras regresan las estrellas icónicas del anime original de Yu-Gi-Oh!. La Early Days Collection reúne los videojuegos clásicos de Yu-Gi-Oh! de la era Game Boy.;https://media.rawg.io/media/screenshots/37b/37b40548493527fc5f08fa64eaf1ec5f.jpg;RPG, Strategy, Simulation;Digital Eclipse;Konami;0.0;;yu-gi-oh-early-days-collection;https://media.rawg.io/media/screenshots/37b/37b40548493527fc5f08fa64eaf1ec5f.jpg;Minimum: Requires a 64-bit processor and operating system OS: Windows 10x64 (64-bit OS Required) Processor: 3GHz CPU Memory: 4 GB RAM Graphics: 1GB DirectX 11.0 compatible video card DirectX: Version 11 Network: Broadband Internet connection Storage: 12 GB available space Sound Card: DirectX 11.0 compatible sound card;Recommended: Requires a 64-bit processor and operating system OS: Windows 10x64 (64-bit OS Required) Processor: 3.5GHz CPU Memory: 8 GB RAM Graphics: 2GB DirectX 11.0 compatible video card DirectX: Version 11 Network: Broadband Internet connection Storage: 12 GB available space Sound Card: DirectX 11.0 compatible sound card;;;5
Zoo Tycoon - Ultimate Animal Collection v14.09.2018;Zoo Tycoon: Ultimate Animal Collection;RAWG;2018.0;La popular saga Zoo Tycoon regresa. Diseña y gestiona el mejor zoológico del mundo, cuidando a más de 100 animales, construyendo recintos y manteniendo a los visitantes felices en la simulación definitiva de zoológicos.;https://media.rawg.io/media/screenshots/4a7/4a70c734fd9919a5ca0406f56abcc3d5.jpg;Simulation;Frontier Developments, Asobo Studios;Microsoft Studios;3.14;;zoo-tycoon-ultimate-animal-collection;https://media.rawg.io/media/screenshots/4a7/4a70c734fd9919a5ca0406f56abcc3d5.jpg;Minimum: OS: Window 7 or higher Processor: Intel Core i3-3210 @ 3.2 GHz || AMD FX-4150 @ 4 GHz Memory: 4 GB RAM Graphics: Nvidia GT GTX 650 || AMD R7 260 DirectX: Version 11 Storage: 10 GB available space;Recommended: OS: Window 7 or higher Processor: Intel Core i5 3330 @ 3.0 GHz || AMD FX-6130 @ 3.6 GHz Memory: 4 GB RAM Graphics: Nvidia GTX 660 Ti || AMD R7 370 DirectX: Version 11 Storage: 10 GB available space;;;3
Zoonomaly v1.1;Zoonomaly;RAWG;2024.0;Zoonomaly es un juego de horror basado en puzles ambientado en un zoológico en mundo abierto. Una experiencia no lineal donde exploras un vasto zoológico invadido por grotescas versiones monstruosas de sus animales, resolviendo puzles y sobreviviendo la noche.;https://media.rawg.io/media/screenshots/bf2/bf2b97bf4886f6a237d2a3b6c7a41d93.jpg;Action, Adventure, Indie;LIGHTS ARE OFF;LIGHTS ARE OFF;0.0;;zoonomaly;https://media.rawg.io/media/screenshots/bf2/bf2b97bf4886f6a237d2a3b6c7a41d93.jpg;Minimum: Requires a 64-bit processor and operating system OS: Windows 10 Processor: Intel Core i5 / AMD Ryzen 5 Memory: 16 GB RAM Graphics: Nvidia GeForce GTX 1660 Ti Storage: 5 GB available space Additional Notes: The game includes graphics settings to aid lower end devices.;Recommended: Requires a 64-bit processor and operating system;;;4
