Titulo_original;Titulo_encontrado;Fuente;Anio;Sinopsis;Poster_URL;Generos;Desarrolladores;Editores;Puntuacion_Usuario;Metascore;URL_Slug;Backdrop_URL;Requisitos_Minimos;Requisitos_Recomendados;Recomendaciones;Trailer_URL;Peso_GB
Far Cry 4;Far Cry 4;RAWG;2014.0;Far Cry 4 es un shooter en primera persona ambientado en la ficticia región himalaya de Kyrat, gobernada por el excéntrico y violento dictador Pagan Min. Únete a una rebelión y lucha por la libertad en un impresionante mundo abierto.;https://media.rawg.io/media/games/b39/b396dac1f3e0f538841aa0355dd066d3.jpg;Shooter;Ubisoft, Ubisoft Montreal;Ubisoft Entertainment;3.82;80.0;far-cry-4;https://media.rawg.io/media/games/b39/b396dac1f3e0f538841aa0355dd066d3.jpg;Minimum: OS: Windows® 7 (SP1) / Windows® 8 / Windows® 8.1 / (64-bit only) Processor: 2.6 GHz Intel® Core™ i5-750 or 3.2 GHz AMD Phenom™ II X4 955 Memory: 4 GB RAM Graphics: NVIDIA GeForce GTX 460 or AMD Radeon HD5850 (1 GB VRAM) DirectX: Version 11 Network: Broadband Internet connection Storage: 30 GB available space Sound Card: DirectX-compatible (5.1 surround sound recommended) Additional Notes: Windows-compatible keyboard, mouse, optional controller (Xbox 360 Controller for Windows recommende;Recommended: OS: Windows® 7 (SP1) / Windows® 8 / Windows® 8.1 / (64-bit only) Processor: 2.5 GHz Intel® Core™ i5-2400S or 4.0 GHz AMD FX-8350 or better Memory: 8 GB RAM Graphics: NVIDIA GeForce GTX 680 or AMD Radeon R9 290X or better (2 GB VRAM) DirectX: Version 11 Network: Broadband Internet connection Storage: 30 GB available space Sound Card: DirectX-compatible (5.1 surround sound recommended) Additional Notes: Supported video cards at the time of release: NVIDIA GeForce GTX 460 or better, Ge;;;17
Far Cry 5;Far Cry 5;RAWG;2018.0;Far Cry 5 es un shooter en primera persona en mundo abierto. Una secta llamada Puerta del Edén ha tomado el control del condado de Hope, en Montana. Lucha junto a combatientes de la resistencia para liberar el condado del fanático Father.;https://media.rawg.io/media/games/bce/bce62fbc7cf74bf6a1a37340993ec148.jpg;Action, Shooter;Ubisoft, Ubisoft Montreal, Ubisoft Toronto, Ubisoft Shanghai, Ubisoft Kiev, Red Storm;Ubisoft Entertainment;3.72;80.0;far-cry-5;https://media.rawg.io/media/games/bce/bce62fbc7cf74bf6a1a37340993ec148.jpg;;;;https://steamcdn-a.akamaihd.net/steam/apps/256686149/movie_max.mp4;44
Far Cry 6;Far Cry 6;RAWG;2021.0;Bienvenido a Yara, un paraíso tropical congelado en el tiempo. Mientras el dictador Antón Castillo cría a su hijo para gobernar la isla, se desata una revolución. Tú eres Dani Rojas: lucha por tu patria contra un régimen despiadado.;https://media.rawg.io/media/games/5dd/5dd4d2dd986d2826800bc37fff64aa4f.jpg;Action, Shooter, Adventure;Ubisoft, Ubisoft Montreal, Ubisoft Toronto, Ubisoft Shanghai, Ubisoft Kyiv, Ubisoft Berlin;Ubisoft Entertainment;3.36;75.0;far-cry-6;https://media.rawg.io/media/games/5dd/5dd4d2dd986d2826800bc37fff64aa4f.jpg;Minimum: Requires a 64-bit processor and operating system OS: Windows 10 (20H1 version or newer, 64-bit versions) Processor: AMD Ryzen 3 1200 @ 3. GHz or Intel Core i5-4460 @ 3.1 GHz (AVX, AVX2 and SSE 4.2 support required) Memory: 8 GB RAM Graphics: AMD RX 460 (4 GB) or NVIDIA GeForce GTX 960 (4 GB) DirectX: Version 12 Storage: 170 GB available space Additional Notes: Please note that the minimum requirement for running the HD Texture Pack for Far Cry 6 is 12GB of VRAM. For 4K configurations, y;Recommended: Requires a 64-bit processor and operating system OS: Windows 10 (20H1 version or newer, 64-bit versions) Processor: AMD Ryzen 5 3600X @ 3.8 GHz or Intel Core i7-7700 @ 3.6 GHz (AVX, AVX2 and SSE 4.2 support required) Memory: 16 GB RAM Graphics: AMD RX Vega 64 (8 GB) or NVIDIA GeForce GTX 1080 (8 GB) DirectX: Version 12 Storage: 170 GB available space Additional Notes: Please note that the minimum requirement for running the HD Texture Pack for Far Cry 6 is 12GB of VRAM. For 4K confi;;;47
Far Cry Primal Apex Edition v1.3.3;Far Cry;RAWG;2004.0;El juego que inició la saga Far Cry. Controla a Jack Carver, varado en una isla tropical invadida por mercenarios y experimentos mutantes.;https://media.rawg.io/media/games/2ee/2eef5ed5e82c28d1299ecc2a0e60f2cb.jpg;Action, Shooter;Ubisoft, Crytek;Ubisoft Entertainment;3.9;89.0;far-cry;https://media.rawg.io/media/games/2ee/2eef5ed5e82c28d1299ecc2a0e60f2cb.jpg;Minimum: Supported OS: Windows® 2000/XP (only) Processor: AMD Athlon™ 1 GHz or Pentium® III 1 GHz Memory: 256 MB Graphics: 64 MB DirectX® 9.0b-compliant graphics card (see supported list*) Sound: DirectX 9.0b compliant PCI card (Sound Blaster Audigy series recommended) DirectX: DirectX 9.0b or higher Hard Disk Space: 4 GB Multiplay: Broadband with 64 Kbps upstream (512 Kbps upstream to host 8 players) Mouse/Keyboard: Windows compatible mouse and keyboard required;"Recommended: Supported OS: Windows 2000/XP (only) Processor: AMD Athlon 2-3 GHz or Pentium 4 2-3 GHz Memory: 512-1024 MB Sound: Sound Blaster® Audigy® series (see supported list*) Graphics: 128 MB GeForce™ 4 128 MB to GeForce FX 5950; ATI Radeon 9500-9800 XT *Supported video cards at time of retail release: NVIDIA GeForce 2/3/4/FX families ( NVIDIA based cards must have ForceWare drivers 53.03 or later; GeForce 2 and GeForce 4 MX cards do not support all graphics features). ATI Radeon 8500/9000 ";;;12
Farm Together 2;Farm Together 2;RAWG;2024.0;¡La exitosa experiencia agrícola regresa! Farm Together 2 mejora el original con nuevos cultivos, animales y opciones de construcción en una relajada simulación agrícola cooperativa.;https://media.rawg.io/media/screenshots/1ec/1ec63c5d5376307155ee6f403ef8c2a3.jpg;Simulation, Casual, Indie;Milkstone Studios;Milkstone Studios;0.0;;farm-together-2;https://media.rawg.io/media/screenshots/1ec/1ec63c5d5376307155ee6f403ef8c2a3.jpg;Minimum: Requires a 64-bit processor and operating system OS *: Windows 7 64bit or newer Processor: Dual Core processor Memory: 4 GB RAM Graphics: DirectX 11 capable hardware DirectX: Version 11 Storage: 2 GB available space;Recommended: Requires a 64-bit processor and operating system OS: Windows 10 or newer Processor: Quad core processor Memory: 8 GB RAM Graphics: GeForce 1060 or better DirectX: Version 11 Network: Broadband Internet connection Storage: 2 GB available space;;;1
Fear & Hunger 2 - Termina v1.9.1;Fear & Hunger 2: Termina;RAWG;2022.0;Solo tienes 3 días para descubrir los secretos que esconde esta tierra maligna. Fear & Hunger 2: Termina es un brutal RPG de survival horror ambientado en un pueblo festivo donde los concursantes deben sobrevivir... o morir en el intento.;https://media.rawg.io/media/screenshots/3ec/3ecb2152d1545f7cac9380c7b6d25a1c.jpg;RPG, Indie;Miro Haverinen;Miro Haverinen;4.22;;fear-hunger-2-termina;https://media.rawg.io/media/screenshots/3ec/3ecb2152d1545f7cac9380c7b6d25a1c.jpg;Minimum: OS: WindowsR 7/8/8.1/10 (32bit/64bit) Processor: Intel Core 2 Duo or better Memory: 2 GB RAM Graphics: DirectX 9/OpenGL 4.1 capable GPU DirectX: Version 9.0 Storage: 1500 MB available space;Recommended: OS: WindowsR 7/8/8.1/10 (32bit/64bit) Processor: Intel Core 2 Duo or better Memory: 2 GB RAM Graphics: DirectX 9/OpenGL 4.1 capable GPU DirectX: Version 9.0 Storage: 1500 MB available space;;;3
Fear & Hunger v1.4.1;Fear & Hunger 2: Termina;RAWG;2022.0;Solo tienes 3 días para descubrir los secretos que esconde esta tierra maligna. Fear & Hunger 2: Termina es un brutal RPG de survival horror ambientado en un pueblo festivo donde los concursantes deben sobrevivir... o morir en el intento.;https://media.rawg.io/media/screenshots/3ec/3ecb2152d1545f7cac9380c7b6d25a1c.jpg;RPG, Indie;Miro Haverinen;Miro Haverinen;4.22;;fear-hunger-2-termina;https://media.rawg.io/media/screenshots/3ec/3ecb2152d1545f7cac9380c7b6d25a1c.jpg;Minimum: OS: WindowsR 7/8/8.1/10 (32bit/64bit) Processor: Intel Core 2 Duo or better Memory: 2 GB RAM Graphics: DirectX 9/OpenGL 4.1 capable GPU DirectX: Version 9.0 Storage: 1500 MB available space;Recommended: OS: WindowsR 7/8/8.1/10 (32bit/64bit) Processor: Intel Core 2 Duo or better Memory: 2 GB RAM Graphics: DirectX 9/OpenGL 4.1 capable GPU DirectX: Version 9.0 Storage: 1500 MB available space;;;2
FIFA 15 1.4.0.0;FIFA 15;RAWG;2014.0;FIFA 15 trae el fútbol a la vida con impresionante detalle. Vive la emoción del deporte con modelos de jugadores auténticos, jugabilidad mejorada y todas las ligas oficiales, clubes y más de 16.000 jugadores.;https://media.rawg.io/media/games/be5/be51faf9bec778b4ea1b06e9b084792c.jpg;Sports;Electronic Arts Canada;Electronic Arts;3.37;82.0;fifa-15;https://media.rawg.io/media/games/be5/be51faf9bec778b4ea1b06e9b084792c.jpg;;;;;12
Fifa 19;FIFA 19;RAWG;2018.0;Impulsado por Frostbite, EA SPORTS FIFA 19 ofrece una experiencia de nivel campeón dentro y fuera del campo, incluyendo la UEFA Champions League y mecánicas de juego actualizadas.;https://media.rawg.io/media/games/b59/b59560a7277b16b53e4786b4abe45baa.jpg;Simulation, Sports;Electronic Arts Vancouver;EA SPORTS;3.31;80.0;fifa-19;https://media.rawg.io/media/games/b59/b59560a7277b16b53e4786b4abe45baa.jpg;;;;;44
Fifa 23 v1.0.82.43747;Fifa 23;RAWG;2022.0;FIFA 23 es un simulador de fútbol de EA Sports, el último bajo esta denominación, que busca ofrecer al usuario el mejor videojuego de fútbol de la historia con más características, modos de juego, contenido del Mundial, clubes, ligas, competiciones y jugadores. Desde la firma norteamericana apuestan por llevar el juego del mundo al campo, con la tecnología HyperMotion2 que ofrece una experiencia de juego aún más realista, tanto la Copa del Mundo masculina como la femenina, que llegarán al juego más adelante en forma de actualización, la incorporación de equipos femeninos, funciones de juego cruzado, y mucho más..;https://media.rawg.io/media/games/dbc/dbcb05bcdf104264db35de68d1e73909.jpg;Casual;FreakyGe;7.0;0.0;;fifa-23-2;https://media.rawg.io/media/screenshots/52a/52ad785b9d1514f100ec89c6d5f22e8c.jpg;;;;;44
Final Fantasy IX v06.08.2020;Final Fantasy IX;RAWG;2000.0;Final Fantasy IX es un videojuego de rol del año 2000 que sigue al ladrón Zidane Tribal, quien secuestra a la Princesa Garnet y queda atrapado en un conflicto que amenaza al mundo. Una carta de amor al estilo clásico de Final Fantasy.;https://media.rawg.io/media/games/826/82626e2d7ee7d96656fb9838c2ef7302.jpg;Adventure, RPG;Square Enix, Sony Interactive Entertainment, Square, GUILD STUDIO, Guld Studio, Silicon Studio Thailand;Electronic Arts, Square Enix, Square;4.35;84.0;final-fantasy-ix;https://media.rawg.io/media/games/826/82626e2d7ee7d96656fb9838c2ef7302.jpg;;;;;4
Final Fantasy VIII Remastered;FINAL FANTASY VIII;RAWG;1999.0;Final Fantasy VIII es un RPG japonés, la octava entrega principal. Sigue al mercenario SeeD Squall Leonhart y a la hechicera Rinoa mientras una misteriosa amenaza del futuro pone al mundo en peligro.;https://media.rawg.io/media/games/f77/f77510051b6a61decc35c5257193fc9e.jpg;RPG;Square;Square Enix, Microsoft Studios, Eidos Interactive, Square, SCE Australia;4.28;90.0;final-fantasy-viii;https://media.rawg.io/media/games/f77/f77510051b6a61decc35c5257193fc9e.jpg;Minimum: OS: Microsoft Windows XP/Vista/7/8 (32/64-bit) Processor: 1Core CPU 2GHz or faster Memory: 1 GB RAM Graphics: DirectX 9.0c compatible card DirectX: Version 9.0c Storage: 4 GB available space Sound Card: Integrated sound chip or more;Recommended: OS: Microsoft Windows Vista/7/8 (32/64-bit) Processor: Intel® Core™2 Duo CPU 3GHz or faster Memory: 4 GB RAM Graphics: NVIDIA GeForce 9600 GT or faster DirectX: Version 9.0c Storage: 4 GB available space Sound Card: Integrated sound chip or more;;;2
Final Fantasy X?X-2 HD Remastered;FINAL FANTASY X/X-2 HD Remaster;RAWG;2013.0;FINAL FANTASY X sigue a Tidus, una estrella del blitzball que viaja al mundo de Spira, donde se une a la peregrinación liderada por la invocadora Yuna para derrotar al colosal monstruo llamado Sin. Incluye la secuela FFX-2 en remasterización HD.;https://media.rawg.io/media/games/a14/a14acef284eaa4854f83c99e80fc15d8.jpg;RPG;Square Enix, Virtuos;Square Enix;4.34;85.0;final-fantasy-xx-2-hd-remaster;https://media.rawg.io/media/games/a14/a14acef284eaa4854f83c99e80fc15d8.jpg;Minimum: OS: Windows Vista or later Processor: 2GHz Dual Core CPU Memory: 1 GB RAM Graphics: NVIDIA Geforce 9600GT VRAM 512MB or later / ATI Radeon HD 2600XT VRAM 512MB or later Storage: 37 GB available space Sound Card: DirectX Compatible Sound Card;Recommended: OS: Windows Vista or later Processor: 2.4GHz quad-core CPU Memory: 2 GB RAM Graphics: NVIDIA Geforce GTX 450 / AMD Radeon HD 5750 with 512MB Storage: 40 GB available space Sound Card: DirectX Compatible Sound Card;;;29
Five Nights at Freddys Security Breach (build 23.08.2023);Five Nights at Freddy's: Security Breach;RAWG;2021.0;El siguiente capítulo del miedo. Security Breach te permite explorar el megacomplejo de entretenimiento Freddy Fazbear's Mega Pizzaplex como Gregory, un joven atrapado que debe sobrevivir una noche entero mientras los animatrónicos Glamrock lo persiguen.;https://media.rawg.io/media/games/f5b/f5b0a8232e747c03aa6b56ce2d2af49a.jpg;Action, Adventure, Indie;Steel Wool Studios;ScottGames;2.91;64.0;five-nights-at-freddys-security-breach;https://media.rawg.io/media/games/f5b/f5b0a8232e747c03aa6b56ce2d2af49a.jpg;Minimum: OS: Windows 10 (64 bit) Processor: AMD Ryzen 5 3600, Core i5 6600K Memory: 8 GB RAM Graphics: Nvidia GeForce GTX 1050 Ti DirectX: Version 12 Storage: 80 GB available space;Recommended: OS: Windows 10 (64 bit) Processor: AMD Ryzen 7 2700X, Intel Core i7 4790 Memory: 16 GB RAM DirectX: Version 12 Storage: 80 GB available space;;;23
Flat Out 2;Flat Heroes;RAWG;2016.0;Flat Heroes es un minimalista e intensísimo juego de acción local para varios jugadores con modos cooperativos y competitivos. Supera precisos retos de plataformas con hasta 4 jugadores en un mundo abstracto y colorido.;https://media.rawg.io/media/screenshots/8f5/8f5a4e32988c86cfc92e592c3b6c43ac.jpg;Action, Indie, Platformer;Parallel Circles, FlatHeroes;Deck13, Deck 13, Parallel Circles;3.3;82.0;flat-heroes;https://media.rawg.io/media/screenshots/8f5/8f5a4e32988c86cfc92e592c3b6c43ac.jpg;Minimum: OS: Windows XP, Vista, 7, 8, 10 Processor: 2Ghz Memory: 4 GB RAM DirectX: Version 9.0;;;https://steamcdn-a.akamaihd.net/steam/apps/256668539/movie_max.mp4;4
Foundation v1.10.2.0;Foundation;RAWG;2019.0;Foundation es una simulación de construcción de ciudades sin cuadrícula y de crecimiento orgánico. Construye un asentamiento medieval desde cero, gestiona recursos y población mientras desbloqueas nuevos edificios y administras las necesidades de tus ciudadanos.;https://media.rawg.io/media/screenshots/cd1/cd1f9f5a5c38c722be96a3f6dac638e3.jpg;Strategy, Simulation, Indie;Polymorph Games;Polymorph Games;3.55;;foundation;https://media.rawg.io/media/screenshots/cd1/cd1f9f5a5c38c722be96a3f6dac638e3.jpg;Minimum: Requires a 64-bit processor and operating system OS: TBD Processor: TBD Memory: 8 GB RAM Graphics: TBD;Recommended: Requires a 64-bit processor and operating system;;;2
Frostpunk v03.08.2022;Frostpunk;RAWG;2018.0;En un mundo completamente congelado, la humanidad ha desarrollado tecnología de vapor para sobrevivir. Como líder de la última ciudad de la Tierra, construye y gestiona una metrópolis impulsada por carbón, equilibrando la supervivencia con decisiones morales cada vez más difíciles.;https://media.rawg.io/media/games/a88/a886c37bf112d009e318b106db9d420a.jpg;Strategy, Simulation;11 Bit Studios;11 bit studios;4.19;85.0;frostpunk;https://media.rawg.io/media/games/a88/a886c37bf112d009e318b106db9d420a.jpg;7 / 8 / 10Processor: Intel(R) Core i7Memory: 16 GB RAMGraphics: GeForce 1060DirectX: Version 11Hard Drive Space: 3 GBSound Card: DirectX compatibleMouse, Keyboard;;;https://steamcdn-a.akamaihd.net/steam/apps/256692982/movie_max.mp4;9
Gas Station Simulator v06.03.2025;Gas Station Simulator;RAWG;2021.0;Construye y gestiona tu propia gasolinera desde cero. Repara coches, reabastecer estantes, limpia surtidores y mejora tus instalaciones en este relajante juego de gestión y simulación.;https://media.rawg.io/media/screenshots/050/050288ef5c2ecb1e8272caf0ce077d7e.jpg;Simulation, Indie;Drago Entertainment;Movie Games, DRAGO entertainment;3.83;72.0;gas-station-simulator;https://media.rawg.io/media/screenshots/050/050288ef5c2ecb1e8272caf0ce077d7e.jpg;Minimum: Requires a 64-bit processor and operating system OS: Windows 7 (64-bit) or 10 (64-bit) Processor: Intel Core i3 3.0 GHz Memory: 4 GB RAM Graphics: NVidia GeForce GTX 660 2GB VRAM DirectX: Version 11 Storage: 10 GB available space;Recommended: Requires a 64-bit processor and operating system OS: Windows 10 Processor: Intel Core i5 (recent generation) Memory: 8 GB RAM Graphics: NVidia GeForce GTX 900-series 4GB VRAM DirectX: Version 11 Storage: 15 GB available space;;;13
Gears of War 1 v1.3;Gears of War: Reloaded;RAWG;2025.0;Vive el origen de una de las franquicias más aclamadas del videojuego como nunca antes. Gears of War: Reloaded es una versión completamente remasterizada del juego original con visuales mejorados y jugabilidad modernizada.;https://media.rawg.io/media/games/213/213248f2ede0b914431446123b291cc0.jpg;Action, Shooter;The Coalition;Microsoft Studios, Xbox Game Studios;2.84;;gears-of-war-reloaded;https://media.rawg.io/media/games/213/213248f2ede0b914431446123b291cc0.jpg;Minimum: Requires a 64-bit processor and operating system OS: Windows10 - 19H2 Processor: AMD Ryzen 3 (Four-Core) or Intel i5 Skylake Memory: 8 GB RAM Graphics: AMD Radeon RX 480 / RX 5300 or Nvidia GeForce GTX 1650 / 1050 Ti or Intel(R) Arc(TM) A380 DirectX: Version 12 Network: Broadband Internet connection Storage: 70 GB available space Sound Card: Windows compatible audio device;Recommended: Requires a 64-bit processor and operating system OS: Windows 10 – 22H2 Windows 11 - 24H2 Processor: AMD Ryzen 5 (Six-Cores) or Intel i5 Coffee Lake Memory: 8 GB RAM Graphics: AMD Radeon RX 5600 or NVIDIA GeForce GTX 1070 / GTX 1660 Ti / RTX 2070 or Intel A580 DirectX: Version 12 Network: Broadband Internet connection Storage: 70 GB available space Sound Card: Windows compatible audio device;;;5
Gears of War 2016 Ultimate Edition;Gears of War;RAWG;2006.0;Gears of War, diseñado por Cliff Bleszinski, revolucionó los disparos con cobertura. Controla a Marcus Fenix, un soldado que lucha contra la Horda Locust en una brutal guerra por salvar a la humanidad en el planeta Sera.;https://media.rawg.io/media/games/988/98834d39955e7f15d3717fac438128aa.jpg;Action, Shooter;Epic Games, People Can Fly;Microsoft Studios;4.12;90.0;gears-of-war;https://media.rawg.io/media/games/988/98834d39955e7f15d3717fac438128aa.jpg;;;;;34
Ghost of Tsushima DIRECTOR'S CUT v1053.0718;Ghost of Tsushima Director's Cut;RAWG;2021.0;Vive la aventura completa de Ghost of Tsushima incluyendo la expansión de la Isla Iki. Controla al samurái Jin Sakai mientras combate la invasión mongola de Tsushima, forjando un nuevo camino que rompe el código del samurái.;https://media.rawg.io/media/games/193/193c9fe23ca026914fdf41d551ff3df9.jpg;Action, Adventure, RPG;Sucker Punch Productions;Sony Interactive Entertainment;4.58;;ghost-of-tsushima-directors-cut;https://media.rawg.io/media/games/193/193c9fe23ca026914fdf41d551ff3df9.jpg;;;;;44
Ghostrunner 2 Brutal Edition;Ghostrunner 2;RAWG;2023.0;Ghostrunner 2 es un brutal slasher en primera persona en un mundo cyberpunk postapocalíptico. Golpea, para y corre sobre obstáculos imposibles a una velocidad vertiginosa, mientras nuevas secuencias en moto amplían la acción.;https://media.rawg.io/media/games/d27/d27010266d135dc7407364e1733484bc.jpg;Action;One More Level;505 Games;3.73;;ghostrunner-2;https://media.rawg.io/media/games/d27/d27010266d135dc7407364e1733484bc.jpg;Minimum: OS: Windows 10 x64 Processor: Intel Core i5-4590 (4 * 3300) or equivalent / AMD FX-8350 (4 * 4000) or equivalent Memory: 8 GB RAM Graphics: GeForce GTX 960 (4096 MB) / Radeon RX 480 (8192 MB) or Intel Arc A380 (8192 MB) DirectX: Version 11 Storage: 65 GB available space Additional Notes: Specs subject to change;Recommended: OS: Windows 10 x64 Processor: Intel Core i9-9900k (8 * 3600) / AMD Ryzen 5 5600X (6 * 3700 ) or equivalent Memory: 16 GB RAM Graphics: GeForce RTX 2070 Super (8192 MB) / Radeon RX 6800 XT (16384 MB) or Intel Arc A770 (16384 MB) DirectX: Version 12 Storage: 65 GB available space Additional Notes: Specs subject to change;;;21
God of War II;God of War II;RAWG;2007.0;El juego se basa en gran medida en la mitología griega antigua y la usa como inspiración y fuente principal para el diseño de enemigos y NPC, así como para el diseño de ubicaciones. Sin embargo, el juego no es una gran fuente de hechos históricos precisos: la historia de la Antigua Grecia fue reescrita en aras del género y el universo del juego, cuyas reglas se establecieron en la primera parte. ###La historia El rey de los dioses Zeus traiciona a Kratos y lo mata, pero el espartano es salvado del Inframundo por otra diosa, Gaia, quien invita a Kratos a encontrar a las Hermanas del Destino y viajar al pasado para evitar su propia muerte. La jugabilidad se mantuvo igual: el jugador puede usar varios ataques, que se pueden combinar y mejorar con la ayuda de la moneda del juego recolectada de los enemigos. El juego tiene muchos eventos de tiempo rápido, que se usan principalmente en batallas con jefes y para finalizar movimientos de combo. Los jefes en el juego, en comparación con la primera parte, aumentaron significativamente.;https://media.rawg.io/media/games/615/615e9fc0a325e0d87b84dad029b8b7b9.jpg;Action;SCE Studios Santa Monica;Sony Computer Entertainment, ak tronic Software & Services;4.4;93;god-of-war-ii;https://media.rawg.io/media/games/615/615e9fc0a325e0d87b84dad029b8b7b9.jpg;;;;;6
Governador of Poker 2;Governor of Poker 2 - Premium Edition;RAWG;2010.0;La Premium Edition incluye 6 ciudades extra, 10 ubicaciones de póker adicionales y 5 oponentes más notorios. Triunfa en el póker del Salvaje Oeste y gana todos los torneos para convertirte en el definitivo Gobernador del Póker.;https://media.rawg.io/media/screenshots/651/651b9f3e4a0ad643ca7f802f96852e65.jpg;Adventure, Simulation, Casual, Indie;I Sioux Game Productions;;0.0;;governor-of-poker-2-premium-edition;https://media.rawg.io/media/screenshots/651/651b9f3e4a0ad643ca7f802f96852e65.jpg;OS: Windows 98SE, 2000, ME, XP, Vista Processor: Pentium III, 1200 MHz Memory: 512 MB RAM Graphics: 16 Mb video card DirectX®: 8 or later Hard Drive: 90 MB Sound: onboard soundcard or soundblaster;;;;1
Grand Theft Auto - San Andreas 1.01;Grand Theft Auto: San Andreas;RAWG;2004.0;La séptima entrega de la saga GTA. Controla a Carl 'CJ' Johnson, que regresa a Los Santos tras el asesinato de su madre. Toma el control de las calles, expande el territorio de la pandilla y descubre una enorme conspiración.;https://media.rawg.io/media/games/960/960b601d9541cec776c5fa42a00bf6c4.jpg;Action;Rockstar North, War Drum Studios;Capcom, Rockstar Games, 1C-SoftClub;4.5;93.0;grand-theft-auto-san-andreas;https://media.rawg.io/media/games/960/960b601d9541cec776c5fa42a00bf6c4.jpg;Minimum: OS: Microsoft® Windows® 2000/XP Processor: 1Ghz Pentium III or AMD Athlon Processor Memory: 256MB of RAM Graphics: 64MB Video Card (Geforce 3 or better) Hard Drive: 3.6GB of free hard disk space (minimal install) Other Requirements: Software installations required including DirectX and Sony DADC SecuROM Partner Requirements: Please check the terms of service of this site before purchasing this software.;Recommended: Processor: Intel Pentium 4 or AMD Athlon XP Processor Memory: 384MB of RAM (the more the better!) Graphics: 128MB (or greater) Video Card (Geforce 6 Series Recommended) Hard Drive: 4.7GB of free hard disk space (full install) Sound Card: DirectX 9 compatible Sound Card (Sound Blaster Auidgy 2 Recommended);;;3
Grand Theft Auto - Vice City 1.1;Grand Theft Auto: Vice City;RAWG;2002.0;Grand Theft Auto: Vice City es un shooter en tercera persona con mundo abierto ambientado en el Miami de 1986. Controla a Tommy Vercetti, un sicario de la mafia que construye un imperio criminal en una ciudad de neón, exceso y cocaína.;https://media.rawg.io/media/games/13a/13a528ac9cf48bbb6be5d35fe029336d.jpg;Action;Rockstar North;Rockstar Games;4.45;94.0;grand-theft-auto-vice-city;https://media.rawg.io/media/games/13a/13a528ac9cf48bbb6be5d35fe029336d.jpg;"Minimum: OS: Microsoft® Windows® 2000/XP Processor: 800 MHz Intel Pentium III or 800 MHz AMD Athlon or 1.2GHz Intel Celeron or 1.2 GHz AMD Duron processor Memory: 128 MB of RAM Graphics: 32 MB video card with DirectX 9.0 compatible drivers (&quot;GeForce&quot; or better) DirectX Version: Microsoft DirectX® 9.0 Hard Drive: 915 MB of free hard disk space (+ 635 MB if video card does NOT support DirectX Texture Compression) Sound Card: Sound Card with DirectX 9.0Recommended: Processor: Intel Pentiu";;;;1
