Titulo_original;Titulo_encontrado;Fuente;Anio;Sinopsis;Poster_URL;Generos;Desarrolladores;Editores;Puntuacion_Usuario;Metascore;URL_Slug;Backdrop_URL;Requisitos_Minimos;Requisitos_Recomendados;Recomendaciones;Trailer_URL;Peso_GB
Outlast 2;Outlast 2;RAWG;2017.0;Outlast 2 es un survival horror en primera persona desarrollado por Red Barrels. El periodista de investigación Blake Langermann queda varado en el desierto de Arizona y debe sobrevivir al culto de Sullivan Knoth solo con una cámara y sus piernas.;https://media.rawg.io/media/games/880/880f6aa65fe9d786f1a455963df76180.jpg;Action, Adventure, Indie;Red Barrels;Red Barrels;3.68;76.0;outlast-2;https://media.rawg.io/media/games/880/880f6aa65fe9d786f1a455963df76180.jpg;Minimum: OS: Windows Vista / 7 / 8 / 10, 64-bits Processor: Intel Core i3-530 Memory: 4 GB RAM Graphics: 1GB VRAM, NVIDIA Geforce GTX 260 / ATI Radeon HD 4870 DirectX: Version 10 Storage: 30 GB available space Sound Card: DirectX Compatible Additional Notes: Targetting 720p @ 30 fps;Recommended: OS: Windows Vista / 7 / 8 / 10, 64-bits Processor: Intel Core i5 Memory: 8 GB RAM Graphics: 1.5GB VRAM, NVIDIA Geforce GTX 660 / ATI Radeon HD 7850 DirectX: Version 11 Storage: 30 GB available space Sound Card: DirectX Compatible Additional Notes: Targetting 1080p @ 60 fps;;https://steamcdn-a.akamaihd.net/steam/apps/256683630/movie_max.mp4;18
Outlast v1.0.12046.0;Outlast;RAWG;2013.0;Horror psicológico cinematográfico. Controla a un periodista que se cuela en un hospital psiquiátrico solo para encontrarlo invadido por pacientes dementes. Sobrevive sin armas: solo una cámara con visión nocturna y tus piernas.;https://media.rawg.io/media/games/9dd/9ddabb34840ea9227556670606cf8ea3.jpg;Action, Indie;Red Barrels;Red Barrels;3.76;80.0;outlast;https://media.rawg.io/media/games/9dd/9ddabb34840ea9227556670606cf8ea3.jpg;Minimum: OS: Windows XP / Vista / 7 / 8 - 64 bits * Processor: 2.2 GHz Dual Core CPU Memory: 2 GB RAM Graphics: 512 MB NVIDIA GeForce 9800GTX / ATI Radeon HD 3xxx series DirectX: Version 9.0c Network: Broadband Internet connection Storage: 5 GB available space Sound Card: DirectX Compatible Additional Notes: * 32 bits systems are not officially supported, but should work if configured to provide 3Gb of user-mode address space. See http://msdn.microsoft.com/en-us/windows/bb613473 or http://steamc;Recommended: OS: Windows Vista / 7 / 8 - 64 bits Processor: 2.8 GHz Quad Core CPU Memory: 3 GB RAM Graphics: 1GB NVIDIA GTX 460 / ATI Radeon HD 6850 or better DirectX: Version 9.0c Network: Broadband Internet connection Storage: 5 GB available space Sound Card: DirectX Compatible;;;3
Overcooked Gourmet Edition;Overcooked;RAWG;2016.0;Overcooked pone a dos chefs en cocinas absurdas: en un camión en marcha, en un iceberg, en el espacio. Trabaja en equipo para picar, cocinar y emplatar platos antes de que se venzan los pedidos en este frenético juego cooperativo.;https://media.rawg.io/media/games/270/270b412b66688081497b3d70c100b208.jpg;Simulation, Arcade, Casual, Indie;Team17 Digital, Ghost Town Games;Team17 Digital;4.07;81.0;overcooked;https://media.rawg.io/media/games/270/270b412b66688081497b3d70c100b208.jpg;Minimum: OS: Windows 7 (32-bit) Processor: Dual Core 2.4Ghz Memory: 2 GB RAM Graphics: GeForce 8800 GT / AMD HD 6850 / Intel HD Graphics 4400 or above DirectX: Version 11 Storage: 750 MB available space Sound Card: DirectX Compatible Sound Card Additional Notes: Gamepads Recommended;;;https://steamcdn-a.akamaihd.net/steam/apps/256667046/movie_max.mp4;1
Overcooked! 2 v26.05.2022;Overcooked! 2;RAWG;2018.0;El caótico cooperativo de cocina regresa. Lanza ingredientes por las cocinas, pasa platos sobre obstáculos y domina nuevas mecánicas en más de 200 niveles. El modo Nueva Partida Plus añade una cuarta estrella a cada fase.;https://media.rawg.io/media/games/d11/d11470677a829e34562e95a4002c2c7f.jpg;Action, Casual, Indie;Team17 Digital, Ghost Town Games;Team17 Digital;4.15;82.0;overcooked-2;https://media.rawg.io/media/games/d11/d11470677a829e34562e95a4002c2c7f.jpg;Minimum: OS: WIN7-64 bit Processor: Intel i3-2100 / AMD A8-5600k Memory: 4 GB RAM Graphics: GeForce GTX 630 / Radeon HD 6570 DirectX: Version 11 Storage: 3 GB available space;Recommended: OS: Win7 -64 bit Processor: Intel i5-650 / AMD A10-5800K Graphics: Nvidia GeForce GTX 650 / Radeon HD 7510 Sound Card: DirectX Compatible Sound Card;;;5
Papers Please 1.1.65;Papers, Please;RAWG;2013.0;Como oficial de inmigración en el ficticio país de bloque soviético de Arstotzka, examina documentos y decide quién puede entrar. Cada decisión tiene peso moral, y la supervivencia de tu familia depende de tu sueldo.;https://media.rawg.io/media/games/6d3/6d33014a4ed48a19c30a77ead5a0f62e.jpg;Simulation, Educational, Indie, Puzzle;Lucas Pope, Dukope1, 3909;3909;4.37;85.0;papers-please;https://media.rawg.io/media/games/6d3/6d33014a4ed48a19c30a77ead5a0f62e.jpg;Minimum: OS: Windows XP or later Processor: 1.5 GHz Core2Duo Memory: 2 GB RAM Graphics: OpenGL 1.4 or better Storage: 100 MB available space Additional Notes: Minimum 1280x720 screen resolution;;;;1
PixARK v1.181;PixARK;RAWG;2018.0;Bienvenido a PixARK, un vasto mundo salvaje lleno de voraces dinosaurios, criaturas mágicas y oscuras mazmorras. Construye y explora en un mundo de vóxeles que combina la construcción de Minecraft con las mecánicas de doma de criaturas de ARK.;https://media.rawg.io/media/screenshots/61f/61fc1a77f243d5cb4b20e6a7d6697ca3.jpg;Action, Adventure, RPG, Strategy, Casual, Massively Multiplayer;Snail Games USA, Snail Games;Snail Games USA, Snail Games;2.43;;pixark;https://media.rawg.io/media/screenshots/61f/61fc1a77f243d5cb4b20e6a7d6697ca3.jpg;Minimum: OS: Windows 7/8.1/10 (64-bit versions) Processor: Intel Core i5-2400/AMD FX-8320 or better Memory: 4 GB RAM Graphics: NVIDIA GTX 660 2GB/AMD Radeon HD 7870 2GB or better DirectX: Version 10 Network: Broadband Internet connection Storage: 15 GB available space Additional Notes: Requires broadband internet connection for multiplayer;;;https://steamcdn-a.akamaihd.net/steam/apps/256706802/movie_max.mp4;1
Planet Zoo Deluxe Edition v1.2.5;Planet Zoo;RAWG;2019.0;Construye un mundo para la vida salvaje en Planet Zoo. De los creadores de Planet Coaster llega la última simulación de gestión de zoológicos, con comportamiento animal auténtico, hábitats y gestión de la experiencia de los visitantes.;https://media.rawg.io/media/screenshots/38f/38f484631d76603231be8bedf658f646.jpg;Strategy, Simulation;Frontier Developments;Frontier Developments;3.91;81.0;planet-zoo;https://media.rawg.io/media/screenshots/38f/38f484631d76603231be8bedf658f646.jpg;Minimum: Requires a 64-bit processor and operating system OS: Windows 7 (SP1+)/8.1/10 64bit Processor: Intel i5-2500 / AMD FX-6350 Memory: 8 GB RAM Graphics: NVIDIA GeForce GTX 770 (2GB) / AMD Radeon R9 270X (2GB) Storage: 16 GB available space Additional Notes: Minimum specifications may change during development;Recommended: Requires a 64-bit processor and operating system OS: Windows 10 64bit Processor: Intel i7-4770k / AMD Ryzen 5 1600 Memory: 16 GB RAM Graphics: NVIDIA GeForce GTX 1070 (8GB) or AMD Radeon RX 580 (8GB) Storage: 16 GB available space;;;9
Plants vs. Zombies - Trasplantado;Plants vs. Zombies;RAWG;2009.0;El famoso juego casual de defensa de torres de PopCap. Planta girasoles, lanzaguisantes, cerezas bomba y docenas de otras plantas para defender tu hogar de un ejército de divertidos pero implacables zombis.;https://media.rawg.io/media/screenshots/590/590aa45fbab8d43b57f93dd60027af7f.jpg;Strategy, Arcade, Puzzle;PopCap Games;Electronic Arts, PopCap Games;4.27;86.0;plants-vs-zombies;https://media.rawg.io/media/screenshots/590/590aa45fbab8d43b57f93dd60027af7f.jpg;;;;;1
Prince of Persia - The Lost Crown;Prince of Persia: The Lost Crown;RAWG;2024.0;Desata al guerrero interior. Usa Poderes del Tiempo, habilidades de combate y plataformas como Sargon, un joven guerrero de los élite Inmortales que debe rescatar a un príncipe secuestrado en la mítica tierra del Monte Qaf.;https://media.rawg.io/media/games/cca/ccaa933775fe1ffcebe40a01f52545db.jpg;Action, Adventure, Platformer;;Ubisoft Entertainment;3.95;;prince-of-persia-the-lost-crown;https://media.rawg.io/media/games/cca/ccaa933775fe1ffcebe40a01f52545db.jpg;;;;;4
Prince of Persia 1 - Arenas del Tiempo;Prince of Persia (2008);RAWG;2008.0;La saga Prince of Persia es conocida por sus acrobáticas plataformas. Este reinicio de 2008 presenta a un nuevo Príncipe y su reacia compañera Elika, viajando por un mundo corrompido por el dios Ahriman.;https://media.rawg.io/media/games/956/95640d5ea0288c187dbce849a4254a41.jpg;Action, Adventure;Ubisoft, Ubisoft Montreal, Gameloft;Ubisoft Entertainment;3.78;82.0;prince-of-persia;https://media.rawg.io/media/games/956/95640d5ea0288c187dbce849a4254a41.jpg;OS: Windows® XP/Windows Vista® (only) Processor: Dual core processor 2.6 GHz Intel® Pentium® D or AMD Athlon™ 64 X2 3800+ (Intel Core® 2 Duo 2.2 GHz or AMD Athlon 64 X2 4400+ or better recommended) Memory: 1 GB Windows XP/2 GB Windows Vista Graphics: 256 MB DirectX® 10.0–compliant video card or DirectX 9.0–compliant card with Shader Model 3.0 or higher (see supported list)* DirectX Version: DirectX 9.0 or 10.0 libraries Hard Drive: 9 GB Sound Card: DirectX 9.0 or 10.0–compliant sound card (5.1 s;;;;1
Prince of Persia 2 - Warrior Within;Prince of Persia: Warrior Within;RAWG;2004.0;Prince of Persia: Warrior Within es una aventura de acción y secuela de Las Arenas del Tiempo. El Príncipe debe viajar a la Isla del Tiempo para evitar la creación de las Arenas del Tiempo y detener a un ser inmortal despiadado.;https://media.rawg.io/media/games/459/459ac8745027643ed7338516c0025cf7.jpg;Action, Adventure;Ubisoft, Ubisoft Montreal, Pipeworks Software;Ubisoft Entertainment;4.4;83.0;prince-of-persia-warrior-within;https://media.rawg.io/media/games/459/459ac8745027643ed7338516c0025cf7.jpg;"Minimum: Supported OS: Windows&reg; 2000/XP (only) Processor: 1 GHz Pentium&reg; III, AMD Athlon&trade;, or equivalent Memory: 256 MB (512 MB recommended) Graphics: NVIDIA GeForce 3 or higher, ATI Radeon 7500 or higher, Intel 915G (NVIDIA GeForce 4 or ATI Radeon 9500, or higher recommended)* Sound: DirectX 9.0-compliant sound card DirectX: DirectX 9.0c Hard Disk Space: 1.5 GB available space for minimum installation, 2.2 GB available space for full installation Supported peripherals: Windows-com";;;;3
Prince of Persia 3 - The Two Thrones;Prince of Persia: The Two Thrones;RAWG;2005.0;Prince of Persia: Las Dos Coronas es un juego de acción rápida en tercera persona y conclusión de la trilogía de Las Arenas del Tiempo. El Príncipe regresa a Babilonia solo para encontrar su ciudad sitiada y su lado oscuro de regreso.;https://media.rawg.io/media/games/dd7/dd72d8a527cd9245c7eb7cd05aa53efa.jpg;Action, Adventure;Ubisoft, Ubisoft Montreal, Ubisoft Casablanca;Ubisoft Entertainment;4.12;85.0;prince-of-persia-the-two-thrones;https://media.rawg.io/media/games/dd7/dd72d8a527cd9245c7eb7cd05aa53efa.jpg;"Minimum: Supported OS: Windows&reg; 2000/XP (only) Processor: 1.0 GHz AMD Athlon or Intel Pentium III (1.5 GHz Pentium IV or AMD Athlon recommended) Memory: 256 MB (512 MB recommended) Graphics:32 MB DirectX 9.0c compliant (128 MB recommended) (see supported list*) DirectX: DirectX 9.0c Sound DirectX 9.0c compliant (Dolby Digital Live required for Dolby Digital audio) Hard Drive:1.5 GB Peripherals: Windows-compatible gamepad *Supported video cards at time of retail release: ATI 7500/8500/9000/X ";;;;2
Prince of Persia 4;Prince of Persia (2008);RAWG;2008.0;Un reinicio de la saga Prince of Persia con arte cel-shadeado. El Príncipe y Elika atraviesan un mundo corrompido usando acrobacias y poderes basados en la luz para restaurar los árboles curativos y combatir las fuerzas de Ahriman.;https://media.rawg.io/media/games/956/95640d5ea0288c187dbce849a4254a41.jpg;Action, Adventure;Ubisoft, Ubisoft Montreal, Gameloft;Ubisoft Entertainment;3.78;82.0;prince-of-persia;https://media.rawg.io/media/games/956/95640d5ea0288c187dbce849a4254a41.jpg;OS: Windows® XP/Windows Vista® (only) Processor: Dual core processor 2.6 GHz Intel® Pentium® D or AMD Athlon™ 64 X2 3800+ (Intel Core® 2 Duo 2.2 GHz or AMD Athlon 64 X2 4400+ or better recommended) Memory: 1 GB Windows XP/2 GB Windows Vista Graphics: 256 MB DirectX® 10.0–compliant video card or DirectX 9.0–compliant card with Shader Model 3.0 or higher (see supported list)* DirectX Version: DirectX 9.0 or 10.0 libraries Hard Drive: 9 GB Sound Card: DirectX 9.0 or 10.0–compliant sound card (5.1 s;;;;5
Prince of Persia 5 - The Forgotten;Prince of Persia: The Forgotten Sands;RAWG;2010.0;Prince of Persia: Las Arenas Olvidadas es una aventura de acción en tercera persona ambientada entre Las Arenas del Tiempo y Warrior Within. El Príncipe descubre el poder de un legendario ejército, con devastadoras consecuencias.;https://media.rawg.io/media/games/9a2/9a2e789046757af843ef0dd2a435adab.jpg;Action, Adventure;Ubisoft Montreal;Ubisoft Entertainment;3.63;75.0;prince-of-persia-the-forgotten-sands;https://media.rawg.io/media/games/9a2/9a2e789046757af843ef0dd2a435adab.jpg;Minimum: OS: Windows XP (SP3) / Windows Vista (SP2) / Windows 7 Processor: 2.6 GHz dual-core Intel Pentium D or AMD Athlon 64 X2 3800+ (2.2 GHz Intel Core 2 Duo or AMD Athlon 64 X2 4400+ or higher recommended) Memory: 1 GB Windows XP / 2 GB Windows Vista, Windows 7 (2 GB / 4 GB recommended) Graphics: 256 MB DirectX 9.0c–compliant card with Shader Model 3.0 or higher (512 MB recommended) (see supported list*) DirectX®: DirectX 9.0c Hard Drive: 8 GB Sound: DirectX 9.0c–compliant sound card (5.1 so;;;;3
Pro Evolution Soccer 2009;Pro Evolution Soccer 2009;RAWG;2008.0;"¡Pro Evolution Soccer regresa en 2009! Los nombres ""PES"" y ""Winning Eleven"" siempre han sido sinónimo de realismo y una jugabilidad excepcional, ¡pero este año PES reducirá aún más la distancia entre el videojuego y la realidad! Nuevos estadios, jugadores, movimientos y modos de juego reforzarán un título ya centrado en ofrecer una experiencia futbolística apasionante. En 2009, Pro Evolution volverá a superar los límites de los juegos de fútbol con la incorporación del modo UEFA Champions League. Ahora, el torneo de fútbol más prestigioso de Europa está al alcance de tu mano. ¡Si fuera más realista, estarías en el propio terreno de juego!";https://media.rawg.io/media/games/e41/e41d8f1826d550f382a97b72f54e5614.jpg;Sports;Konami Digital Entertainment;Konami;3.61;;pes-2009;https://media.rawg.io/media/games/e41/e41d8f1826d550f382a97b72f54e5614.jpg;;;;;7
Pro Evolution Soccer 2016;Pro Evolution Soccer 2016;RAWG;2015.0;La versión Games on Demand es compatible con inglés y francés. PES 2016 llega con una gran variedad de características nuevas y mejoradas, dispuesto a elevar el listón una vez más en su intento por revalidar el título de «Mejor juego de deportes». Con más de 400 equipos, más de 10 000 jugadores reales y más de 2000 rostros de jugadores fotorrealistas, celebra su 20.º aniversario con el juego de fútbol más avanzado hasta la fecha. Ama el pasado, juega el futuro. La última actualización en línea incorporará el nuevo modo UEFA EURO 2016.;https://media.rawg.io/media/games/8dd/8dd95766d6f1dfcfe47128a82ed22699.jpg;Sports;PES Productions;Konami;3.48;83;pes-2016;https://media.rawg.io/media/games/8dd/8dd95766d6f1dfcfe47128a82ed22699.jpg;;;;;10
Pro Evolution Soccer 2017;Pro Evolution Soccer 2017;RAWG;2016.0;La galardonada serie regresa para llevar su célebre jugabilidad a un nuevo nivel, logrando una realidad interactiva tanto en el control como en unos gráficos renovados y auténticos. Toma el control de la realidad en Pro Evolution Soccer 2017 con estas nuevas características: • Real Touch: los jugadores controlan el balón de formas únicas según dónde y cómo los manejes • IA adaptativa: por primera vez en un juego de fútbol, ​​la IA aprenderá tu estilo de juego y se adaptará a él Movimiento natural de los jugadores: se han añadido cientos de nuevas animaciones para dar vida a los futbolistas • Porteros: los guardametas experimentan una gran mejora en su calidad gracias a nuevos movimientos y animaciones myClub: ficha a los jugadores que quieras con la nueva función de ojeadores y subastas de myClub.;https://media.rawg.io/media/games/537/5370caa62388062ccb3d4a1f9ca0e2e1.jpg;Simulation, Sports;PES Productions;Konami;3.72;69;pes-2017;https://media.rawg.io/media/games/537/5370caa62388062ccb3d4a1f9ca0e2e1.jpg;"Minimum: OS: Windows 10, 8.1, 8, 7 SP1, Vista SP2 Processor: Intel Core2 Duo 1.8GHz / AMD Athlon Ⅱ X2 240 or equivalent processor Memory: 1 GB RAM Graphics: DirectX 9.0c compatible video card. 1024MB Pixel Shader 3.0 (NVIDIA GeForce 8800 / AMD/ATI Radeon X1600 / Intel HD Graphics 3000 or better) DirectX: Version 9.0c Storage: 8 GB available space Sound Card: DirectX 9.0c compatible sound card Additional Notes: 800 x 600 monitor resolution; 4x DVD-ROM Drive; TCP/IP 512 kbps or higher";"Recommended: OS: Windows 10, 8.1, 8, 7 SP1, Vista SP2 Processor: Intel Core i3 530 / AMD Phenom Ⅱ X4 925 or equivalent processor Memory: 2 GB RAM Graphics: DirectX 9.0c compatible video card. 1024MB Pixel Shader 3.0 (NVIDIA GeForce GTX 260 / AMD/ATI Radeon HD4850 / Intel HD Graphics 4000 or better) DirectX: Version 9.0c Storage: 8 GB available space Sound Card: DirectX 9.0c compatible sound card Additional Notes: 1280 x 720 monitor resolution; 8x DVD-ROM Drive; TCP/IP 1.5 Mbps or higher";;https://steamcdn-a.akamaihd.net/steam/apps/256675626/movie_max.mp4;11
Pro Evolution Soccer 2010;Pro Evolution Soccer 2010;RAWG;2009.0;Vive la acción del campo de fútbol aún más de cerca con PES 2010 - Pro Evolution Soccer para Wii. Esta última entrega del exitoso simulador de fútbol incorpora nuevas características para que la temporada 2010 sea más realista que nunca, perfeccionando su innovador sistema de control para que puedas dirigir el ritmo del juego con mayor precisión. Con el modo oficial de la UEFA Champions League, PES 2010 te pone en la piel de las mayores estrellas del fútbol mundial mientras tomas las riendas de tus clubes y selecciones favoritos en competiciones de liga y copa. Lucha por una plaza en la Champions League derrotando a tus rivales en la Liga Máster, o compite en línea contra jugadores de todo el mundo utilizando el equipo que has creado en los modos Liga Máster, Champions Road o My Team, haciendo así que la victoria sepa aún mejor.;https://media.rawg.io/media/games/bea/bea83848cf71a819319bb9e321b4aff1.jpg;Sports;Konami Digital Entertainment;Konami;3.81;;pes-2010;https://media.rawg.io/media/games/bea/bea83848cf71a819319bb9e321b4aff1.jpg;;;;;5
Project Zomboid v41.78.16;Project Zomboid;RAWG;2013.0;Project Zomboid combina el survival horror con el RPG. Sobrevive solo o con otros en el condado de Knox, una zona de Kentucky infestada de zombis. Gestiona el hambre, la sed, la enfermedad y la salud mental mientras fortaleces tu base.;https://media.rawg.io/media/screenshots/243/2436b84b99f1121c302367f0c5901b84.jpg;RPG, Indie;The Indie Stone;The Indie Stone;3.87;;project-zomboid;https://media.rawg.io/media/screenshots/243/2436b84b99f1121c302367f0c5901b84.jpg;Nb. This is an Early Access game. A demo has been provided so you can be sure the game runs on your set-up to your satisfaction. Radeon 4xxx series (or below) graphics cards / Please make sure to try the demo before purchasing! OS: Windows XP, Vista, 7, 10 64bit OS required Processor: Intel 2.77GHz Dual Core Memory: 2Gb Ram Hard Disk Space: 1.23gig Video Card: OpenGL 2.1 compatible dedicated graphics card Sound: OpenAL compatible sound card;;;;7
Prototype 2;Prototype 2;RAWG;2012.0;Prototype 2 es un juego de acción de ciencia ficción de Radical Entertainment. El sargento James Heller, consumido por la rabia tras perder a su familia víctima del virus, persigue a Alex Mercer por un devastado Nueva York Zero.;https://media.rawg.io/media/games/445/44507fdd60a8ec02b1c3c64a293ca754.jpg;Action, Adventure;Activision, Radical Entertainment, Radical;Activision Blizzard;3.8;76.0;prototype-2;https://media.rawg.io/media/games/445/44507fdd60a8ec02b1c3c64a293ca754.jpg;Minimum: OS: Windows® XP / Vista / 7 Processor: Intel Core 2 Duo 2.6GHz, AMD Phenom X3 8750 Memory: 2 GB RAM Hard Disk Space: 10 GB Video Card: NVIDIA GeForce 8800 GT with 512 MB RAM, ATI Radeon HD 4850 with 512 MB RAM DirectX®: 9.0C or later Sound: Any DirectX 9 compatible Sound Card Supported Input Devices: Keyboard, Mouse, Xbox 360® Controller;Recommended: OS: Windows 7 Processor: Intel Core 2 Quad 2.7 GHz or better, AMD Phenom II X4 3 GHz or better Memory: 4 GB Video Card: NVIDIA GeForce GTX 460 (1GB) or better, ATI Radeon HD 5850 (1GB) or better;;;11
R.B.I Baseball 21;R.B.I. Baseball 21;RAWG;2021.0;Juega a tu manera. Crea un legado y deja tu huella en esta accesible simulación de béisbol de la MLB con todos los equipos, jugadores y estadios oficiales.;https://media.rawg.io/media/games/558/5583b24360f745f452c5ccd4bb50df69.jpg;Simulation, Sports;MLB, MLB Advanced Media, L.P.;Major League Baseball Advanced Media, MLB Advanced Media, MLB;0.0;;rbi-baseball-21;https://media.rawg.io/media/games/558/5583b24360f745f452c5ccd4bb50df69.jpg;Minimum: OS: Windows 7, Windows 8.1, or Windows 10 Processor: Intel® Core2 Duo E8400 / AMD Phenom II X2 550 Memory: 4 GB RAM Graphics: NVIDIA® GeForce® GTX 460/AMD® Radeon™ HD 6670 DirectX: Version 10 Storage: 11 GB available space Sound Card: DirectX 9.0X compatible;Recommended: OS: Windows 10 64-bit Processor: Intel Core i5 or AMD A10 7870K Memory: 8 MB RAM Graphics: NVIDIA® GeForce® GTX 760/AMD® Radeon™ R9 200 Series DirectX: Version 12 Storage: 11 GB available space Sound Card: DirectX 9.0X compatible;;;9
Rayman Origins 1.0.32504;Rayman Origins;RAWG;2011.0;Rayman Origins es un plataformas 2D, la cuarta entrega principal de Rayman. Guía a Rayman, Globox y los Teensies por exuberantes entornos dibujados a mano para rescatar a los Electoons y derrotar a los Darktoons.;https://media.rawg.io/media/screenshots/375/375f84d018242d7519a230f623981217.jpg;Action, Arcade, Family, Platformer;Ubisoft, Feral Interactive, Ubisoft Casablanca, UBIart Montpellier;Ubisoft Entertainment, Feral Interactive;4.13;86.0;rayman-origins;https://media.rawg.io/media/screenshots/375/375f84d018242d7519a230f623981217.jpg;Minimum: OS: Windows® XP / Windows Vista® / Windows® 7 (only) Processor: 3.0 GHz Intel® Pentium® 4 or 1.8 GHz AMD Athlon™ 64 3000+ Memory: 1 GB Windows XP / 1.5 GB Windows Vista, 7 Video Card: 128 MB DirectX® 9.0c-compliant video card or higher* (see supported list) Sound: DirectX 9.0c-compliant Peripherals Supported: Windows-compatible keyboard, mouse, optional controller (Xbox 360® Controller for Windows recommended)*Supported Video Cards at Time of Release: ATI Radeon™ X600 XT – HD 2600 XT se;Recommended: OS: Windows® XP / Windows Vista® / Windows® 7 (only) Processor: 2.0 GHz Intel® Core™2 Duo E4400 or 2.0 GHz AMD Athlon™ X2 3800+ or better Memory: 2 GB recommended Video Card: 128 MB DirectX® 9.0c-compliant video card or higher* (see supported list) Sound: DirectX 9.0c-compliant Peripherals Supported: Windows-compatible keyboard, mouse, optional controller (Xbox 360® Controller for Windows recommended)*Supported Video Cards at Time of Release: ATI Radeon™ X600 XT – HD 2600 XT series ;;;2
ReCore Definitive Edition;ReCore: Definitive Edition;RAWG;2017.0;Joule Adams, una de las primeras voluntarias para una colonia utópica, despierta en el desolado mundo de Far Eden mucho después de que el plan haya salido mal. Forma un equipo de leales compañeros robot y lucha para reclamar el planeta.;https://media.rawg.io/media/games/d76/d76bd51161884d729ceac7e98eacde80.jpg;Action, Adventure, Platformer;Armature Studio, Comcept;Microsoft Studios;3.26;;recore-definitive-edition-2;https://media.rawg.io/media/games/d76/d76bd51161884d729ceac7e98eacde80.jpg;;;;;13
Red Alert 2 v1.006;Command & Conquer: Red Alert 2;RAWG;2000.0;Red Alert 2 incluye dos facciones jugables, los soviéticos y los aliados, ambas presentes anteriormente en Command & Conquer: Red Alert. La campaña para un jugador se estructura en torno a finales alternativos en lugar de seguir un modo historia lineal. Al igual que su predecesor, Red Alert 2 cuenta con numerosas secuencias cinemáticas de acción real entre misiones y durante el juego, con un reparto que incluye a Ray Wise, Udo Kier, Kari Wuhrer y Barry Corbin..;https://media.rawg.io/media/games/673/67304bfba37b6a18c50a60ab6ba6cebd.jpg;Strategy;Westwood Studios;Electronic Arts;4.36;84.0;command-conquer-red-alert-2;https://media.rawg.io/media/games/673/67304bfba37b6a18c50a60ab6ba6cebd.jpg;;;;;1
